<?xml version="1.0" encoding="utf-8" ?>
<Project xmlns:xsi="http://www.w3.org/2001/XMLSchema-instance"
         xsi:noNamespaceSchemaLocation="XSD/project_explorer.xsd">
    <Name>Electrical Conductivity</Name>
    <ProjectType>EC</ProjectType>
    <Node xpathlabel="Name">
        <Children>
            <Repeater label="Realizations" xpath="Realizations/EC">
                <!-- this is a template for how each realization should render-->
                <Node xpathlabel="Name">
                    <Children collapsed="false">
                        <Node label="Inputs" xpath="Inputs">
                            <Children>
                                <Node xpathlabel="Name" xpath="Vector[@id='CATCH_POLY']" type="vector" symbology="input_catchmentarea"/>
                                <Node xpathlabel="Name" xpath="Vector[@id='STRM_LINE']" type="vector" symbology="input_streamnetwork"/>
                            </Children>
                        </Node>
                        <Node label="Analyses" xpath="Analyses">
                            <Children>
                                <Node label="Outputs" xpath="Analysis/Outputs">
                                    <Children>
                                        <Node xpathlabel="Name" xpath="Vector" type="vector" symbology="Conductivity"/>
                                    </Children>
                                </Node>
                            </Children>
                        </Node>
                    </Children>
                </Node>
            </Repeater>
        </Children>
    </Node>
</Project>