<?xml version="1.0" encoding="utf-8" ?>
<Project xmlns:xsi="http://www.w3.org/2001/XMLSchema-instance"
         xsi:noNamespaceSchemaLocation="XSD/project_explorer.xsd">
    <Name>RVD</Name>
    <ProjectType>GPP</ProjectType>
    <Node xpathlabel="Name">
        <Children>
            <Repeater label="Realizations" xpath="Realizations/GPP">
                <!-- this is a template for how each realization should render-->
                <Node xpathlabel="Name">
                    <Children collapsed="false">
                        <Node label="Conductivity" xpath="Inputs/Vector[@ref='cond1']" type="vector" symbology="Conductivity"/>
                        <Node label="Solar" xpath="Inputs/Vector[@ref='solar1']" type="vector" symbology="Solar_Vector"/>
                        <Node label="Temperature" xpath="Inputs/TemperatureModel" type="vector" symbology="StreamTemp"/>
                        <Repeater label="Analysis" xpath="Analyses/Analysis/Outputs/Vector">
                            <Node xpathlabel="Name" xpath="Vector" type="vector" symbology="GPP_Prediction"/>
                        </Repeater>
                    </Children>
                </Node>
            </Repeater>
        </Children>
    </Node>
</Project>