<?xml version="1.0" encoding="utf-8" ?>
<Project xmlns:xsi="http://www.w3.org/2001/XMLSchema-instance"
         xsi:noNamespaceSchemaLocation="XSD/project_explorer.xsd">
    <Name>Solar Insolation</Name>
    <ProjectType>Solar</ProjectType>
    <Node xpathlabel="Name">
        <Children>
            <Repeater label="Realizations" xpath="Realizations/Solar">
                <!-- this is a template for how each realization should render-->
                <Node xpathlabel="Name">
                    <Children collapsed="false">
                        <Node label="Inputs" xpath="Inputs">
                            <Children>
                                <Node xpathlabel="Name" xpath="Raster[1]" type="raster" symbology="DEM"/>
                                <Node xpathlabel="Name" xpath="Raster[2]" type="raster" symbology="input_vegheight"/>
                                <Node xpathlabel="Name" xpath="Vector[1]" type="vector" symbology="input_streamnetwork"/>
                                <Node xpathlabel="Name" xpath="Vector[2]" type="vector" symbology="input_streamarea"/>
                            </Children>
                        </Node>
                        <Node label="Analyses" xpath="Analyses">
                            <Children>
                                <Node label="Outputs" xpath="Analysis/Outputs">
                                    <Children>
                                        <Node label="Predicted Solar Insolation Raster" xpath="Raster" type="raster" symbology="Solar_Raster"/>
                                        <Node label="Predicted Solar Insolation Vector" xpath="Vector" type="vector" symbology="Solar_Vector"/>
                                    </Children>
                                </Node>
                            </Children>
                        </Node>
                    </Children>
                </Node>
            </Repeater>
        </Children>
    </Node>
</Project>